{"$schema":"https://json-schema.org/draft/2020-12/schema","title":"Model binding for a shared study","type":"object","required":["schema_version","binding_id","study_id","study_version","subjects","seed","output_directory"],"properties":{"schema_version":{"const":"1.0"},"binding_id":{"type":"string"},"study_id":{"type":"string"},"study_version":{"type":"string"},"subjects":{"type":"array","minItems":1,"items":{"type":"object","required":["role","family_id","model_alias"],"properties":{"role":{"type":"string"},"family_id":{"type":"string"},"model_alias":{"type":"string"}},"additionalProperties":false}},"evaluators":{"type":"array","items":{"type":"object"}},"seed":{"type":"integer"},"output_directory":{"type":"string"},"notes":{"type":"string"}},"additionalProperties":false}
