{"schema_version":"1.0","binding_id":"replace-model-family-and-study-v1","study_id":"ch10-reward-hacking","study_version":"1.0.0","subjects":[{"role":"reference","family_id":"replace_family","model_alias":"base"},{"role":"intervention","family_id":"replace_family","model_alias":"aligned"}],"evaluators":[{"role":"behavioural_judge","type":"independent_classifier"},{"role":"audit","type":"blinded_human_review"}],"seed":27001,"output_directory":"../../results/ch10-reward-hacking","notes":"Copy only this binding into a new model-family studies directory; reuse the shared study unchanged."}
